{
  "document_type": "RLMResearchData.locale",
  "schema_version": 2,
  "locale": "en-US",
  "direction": "ltr",
  "fallback_locale": "en-US",
  "trees": {
    "economy": "Economy"
  },
  "research": {
    "economy_construction_speed": "Construction Speed"
  },
  "metrics": {
    "construction_speed": "Construction Speed"
  }
}
